Question Title,Question Ref. ID,Question Text,Calculated Average,Calculated Std.,Option 0 Label,Option 0 selections,Option 1 Label,Option 1 selections,Option 2 Label,Option 2 selections,Option 3 Label,Option 3 selections,Option 4 Label,Option 4 selections,Option 5 Label,Option 5 selections,Option 6 Label,Option 6 selections,Option 7 Label,Option 7 selections,Option 8 Label,Option 8 selections,Option 9 Label,Option 9 selections
Organization,177,Evaluate the organization and coherence of the lectures:,4.085714285714285,0.8868791472623199,Excellent,13,Good,14,Satisfactory,6,Unsatisfactory,2,Very poor,0,No opinion,1
Explanations,178,At what levels were the instructor's explanations aimed?:,4.542857142857143,0.6572159257878978,Too high,0,Somewhat too high,10,Just Right,22,Somewhat too low,3,Too low,0,No opinion,1
Questions,179,Evaluate the instructor's treatment of students' questions:,4.457142857142857,0.6108266887567037,Excellent,18,Good,15,Satisfactory,2,Unsatisfactory,0,Very poor,0,No opinion,1
Visual Presentation,180,"Evaluate the effectiveness of the instructor's visual presentation (blackboard, overheads, etc.):",4.3428571428571425,0.7252933338781401,Excellent,17,Good,13,Satisfactory,5,Unsatisfactory,0,Very poor,0,No opinion,1
Oral Presentation,181,Evaluate the effectiveness of the instructor's oral presentation:,4.457142857142857,0.6572159257878978,Excellent,19,Good,13,Satisfactory,3,Unsatisfactory,0,Very poor,0,No opinion,1
Availability,182,Was the instructor available for help outside of class?:,4.0,1.023532631438318,Available,8,Usually available,8,Sometimes available,5,Rarely available,0,Unavailable,1,Did not seek help,14
Ability to hold Interest,184,Did you find the course interesting?,3.1470588235294117,1.131701667004871,Very interesting,8,Interesting,15,Not interesting,11,No opinion,2
Effectiveness,185,Evaluate the overall effectiveness of the instructor as a teacher:,4.264705882352941,0.7511132557708274,Excellent,15,Good,13,Satisfactory,6,Unsatisfactory,0,Very poor,0,No opinion,2
Attendance,187,What proportion of lectures did you attend in this course?,75.41666666666667,25.195662892081817,90-100%,21,75-90%,9,50-75%,2,25-50%,2,<25%,2
Assigned Work,188,"Was the assigned work (assignments, projects, etc.) helpful in learning the course content?",3.46875,1.015504800579495,Very helpful,9,Helpful,20,Not helpful,3,No work assigned,4
Printed Notes,189,Were the printed notes (if any) helpful in learning the course content?,3.6,0.9403246919632543,Very helpful,6,Helpful,14,Not helpful,0,No printed notes,11
Textbook,190,Was the required textbook (if any) helpful in learning the course content?,4.352941176470588,0.949716159867634,Very helpful,23,Helpful,11,Not helpful,0,No text required,0
New Material,191,Did the course introduce an appropriate amount of new material?,4.111111111111111,1.0630892390381583,Too much,6,Somewhat too much,14,Right amount,16,Somewhat too little,0,Too little,0,No opinion,0
Assigned Work Amount,192,Was the amount of assigned work required for the course appropriate?,4.529411764705882,0.787604504567472,Too much,2,Somewhat too much,10,Right amount,22,Somewhat too little,0,Too little,0,No opinion,2
Hours Per Week,193,"On average, how many hours per week did you spend on this course outside of lectures?",6.736111111111111,4.009784659538839,0-2 hours,4,3-6 hours,17,7-10 hours,8,11-15 houts,6,> 15 hours,1
Metrics
Metric Title,Metric Description,Metric Value,Metric Calculation
Tompa Score,Computed Tompa Score (also acts as evaluate prof score),4.1011685924369745,(@avg(177)*0.8+@avg(188)*0.2)*0.25 + ((@avg(178)+@avg(179)+@avg(180)+@avg(181)+@avg(182))/5.0)*0.25 + (@avg(184)*0.2+@avg(185)*0.8)*0.5
Effectiveness,Computed effectiveness score,4.041176470588235,@avg(184)*0.2+@avg(185)*0.8
Delivery,Computed delivery score,4.359999999999999,(@avg(178)+@avg(179)+@avg(180)+@avg(181)+@avg(182))/5.0
Prep,Computed prep score,3.9623214285714288,@avg(177)*0.8+@avg(188)*0.2
Attendance Percentage,Average response for attendance,75.41666666666667,@avg(187)
Hours/Week,Average time spent per week on work,6.736111111111111,@avg(193)
